{
  "admission_ready": false,
  "blockers": [
    "access_log_anchor_set_mismatch",
    "access_log_set_mismatch",
    "admission_not_ready",
    "evaluation_access_not_ready:contractnli-confirmatory-v2:ValidationError:access log is missing",
    "evaluation_access_not_ready:eventstoryline-v1.5-confirmatory-v2:ValidationError:access log is missing",
    "evaluation_access_not_ready:evidencebench-original-test-confirmatory-v2:ValidationError:access log is missing",
    "evaluation_access_not_ready:hf-logic-owa-v1-confirmatory-v2:ValidationError:access log is missing",
    "evaluation_access_not_ready:hf-process-state-v1-confirmatory-v2:ValidationError:access log is missing",
    "evaluation_access_not_ready:socialiqa-v1.4-validation-confirmatory-v2:ValidationError:access log is missing",
    "evaluation_access_not_ready:vitaminc-confirmatory-v2:ValidationError:access log is missing",
    "evaluation_licence_not_ready:contractnli:ValidationError:licence assessment is not approved",
    "evaluation_licence_not_ready:eventstoryline-v1.5:ValidationError:licence assessment is not approved",
    "evaluation_licence_not_ready:evidencebench-original-test:ValidationError:licence assessment is not approved",
    "evaluation_licence_not_ready:hf-logic-owa-v1:ValidationError:licence assessment is not approved",
    "evaluation_licence_not_ready:hf-process-state-v1:ValidationError:licence assessment is not approved",
    "evaluation_licence_not_ready:socialiqa-v1.4-validation:ValidationError:licence assessment is not approved",
    "evaluation_licence_not_ready:vitaminc:ValidationError:licence assessment is not approved",
    "foundation_bytes_not_ready",
    "licensing_not_ready",
    "public_confirmatory_not_ready",
    "public_evaluation_not_ready:contractnli:ValidationError:evaluation is not sealed and blocker-free",
    "public_evaluation_not_ready:eventstoryline-v1.5:ValidationError:evaluation is not sealed and blocker-free",
    "public_evaluation_not_ready:evidencebench-original-test:ValidationError:evaluation is not sealed and blocker-free",
    "public_evaluation_not_ready:hf-logic-owa-v1:ValidationError:evaluation is not sealed and blocker-free",
    "public_evaluation_not_ready:hf-process-state-v1:ValidationError:evaluation is not sealed and blocker-free",
    "public_evaluation_not_ready:socialiqa-v1.4-validation:ValidationError:development or validation partition cannot be confirmatory",
    "public_evaluation_not_ready:vitaminc:ValidationError:evaluation is not sealed and blocker-free",
    "publisher_checksum_pins_not_verified",
    "quarantine_index_missing",
    "quarantine_not_ready",
    "seal_set_mismatch",
    "source_audit_missing",
    "source_audit_not_ready",
    "source_licence_not_ready:enwiki@20260801:ValidationError:licence assessment is not approved",
    "source_licence_not_ready:wikidata@20260720-json:ValidationError:licence assessment is not approved",
    "storage_attestation_missing",
    "structural_inventory_not_ready"
  ],
  "contracts_frozen": true,
  "evaluated_at": "2026-08-18T12:00:00+10:00",
  "evidence": [
    "evaluation_registry:sha256:46271152e9fb6ffee0da8216cd10850aab7743d60d198dc91132c8d4dd0010d6",
    "licence_assessment:contractnli-rights-v2:sha256:5c62a6b432e3103137b8442cba71a0a3242fbf516bc36decdd843ab43b568622",
    "licence_assessment:enwiki-20260801-rights-v2:sha256:6f13bc6d7e717a3b8b954da61000e60f7e530a58be873208ecf94f468126b3fe",
    "licence_assessment:eventstoryline-v1.5-rights-v2:sha256:9f9dcd5f7e3b8b69dc3567822a5a79da2d25d3d92500d72d77536f4d171846ca",
    "licence_assessment:evidencebench-original-test-rights-v2:sha256:65d0f65065500cbb8a0a44ee0a40a5d2b605d22606c2d116b03cf8d7f9ccae57",
    "licence_assessment:hf-logic-owa-v1-rights-v2:sha256:c404cf82bc7fb006ae392e2f79c058168518279c02799aec7af98ca959c488bc",
    "licence_assessment:hf-process-state-v1-rights-v2:sha256:c6627a47d83ba5301b27af916955f9b0a27aa4b03b6672626af339942a27435c",
    "licence_assessment:socialiqa-v1.4-validation-rights-v2:sha256:ff770b2b1314db2f1176ab6120333094f88d750a8fd29d282bdee6076a27de8a",
    "licence_assessment:vitaminc-rights-v2:sha256:518c83d6cee4119b0a09976b1a23abf1e1abb57d9775906ccf1373d86ccec5f2",
    "licence_assessment:wikidata-20260720-rights-v2:sha256:8f602bb2b90f0739acd0d139fdc268c19cac3f5f67f68c3f1282c59eee2ef680",
    "licence_bundle:contractnli-rights-v2:sha256:7f082c7065c60d550c7c0761099565f6160f53a60815bfdd4ddb6ed2047172c4",
    "licence_bundle:enwiki-20260801-rights-v2:sha256:dcae55354c4d1a6dd24c5a7c0575acf53c0d071eb0a89aa3c84c5d4cd2053e51",
    "licence_bundle:eventstoryline-v1.5-rights-v2:sha256:887ff651fbc4829e7dc97bd95dd2593ce0ecf29169c465c77ff8086946a30f17",
    "licence_bundle:evidencebench-original-test-rights-v2:sha256:3accff0bf6d5aa8f3962d4329dc49762ec85e0c90f15926de1ec4524fb2a6ef1",
    "licence_bundle:hf-logic-owa-v1-rights-v2:sha256:dd1437b780f800e055b6e62f6df4f28413966bece89cea2b7eb9116b41f85db1",
    "licence_bundle:hf-process-state-v1-rights-v2:sha256:0f931f779fd7c43b53286ca56f0d82182ba39d612c890840dc04648dfb974e21",
    "licence_bundle:socialiqa-v1.4-validation-rights-v2:sha256:c038c8109c4e192d6294df573b530b51cabd8efd6195d2e11ef2612cbca9f30d",
    "licence_bundle:vitaminc-rights-v2:sha256:533b303e2735d88bc0c46a15c680f8769927a8cd796c218dab7fe2d570b5b524",
    "licence_bundle:wikidata-20260720-rights-v2:sha256:3d5f5040d29f2dc5a01d250c5d494f74d18dff65678e50ac00b859160e588505",
    "licensing_v1_schemas:sha256:3d02dfcbc0cfcf240728003d85c0294f099c12cb7da04bcd64a1c9a51c589bd1",
    "phase0_v2_dependency_schemas:sha256:81e4ed52680bd1734e8aa5c3988b8000296fc683d46540d3fec5a9c72a0c58bd",
    "phase0_v2_schemas:sha256:81e4ed52680bd1734e8aa5c3988b8000296fc683d46540d3fec5a9c72a0c58bd",
    "phase0_v3_schemas:sha256:f28d8449e6c289b1784ebb8de81716c4156db2ae201dd249cca64bbb724fd7a7",
    "source_registry:sha256:4ec850b59b90c189fd68c64868db60834e746b9a2275b692037688be8c72dd3a"
  ],
  "foundation_acquisition_authorized": false,
  "foundation_transform_ready": false,
  "gate_id": "phase0-public-foundation-v3",
  "licensing_evidence_verified": true,
  "licensing_ready": false,
  "public_confirmatory_ready": false,
  "quarantine_ready": false,
  "schema_version": "3.0.0",
  "source_audit_ready": false,
  "storage_identity_ready": false,
  "structural_inventory_ready": false,
  "training_authorized": false
}
